{
  "stages": [
    {
      "id": "discovery",
      "name": "Discovery",
      "order": 1,
      "description": "Uncover the customer's current browser environment, legacy app dependencies, security posture, and device landscape before pitching.",
      "color": "blue",
      "icon": "Search",
      "questions": [
        {
          "id": "d-q-browser-mgmt",
          "question": "How are your employees' browsers currently managed — does IT push policies centrally, or are users running whatever they like?",
          "purpose": "Determine whether there's any existing browser governance — the starting point for the CEP conversation. Most orgs have zero visibility here.",
          "followUps": [
            "Who in IT owns browser policy today?",
            "Are browser updates handled centrally or left to individual users?",
            "Do you have visibility into which extensions employees have installed?"
          ],
          "keywords": ["browser", "chrome", "edge", "firefox", "managed", "policy", "extension", "update"],
          "industryTips": {
            "financial-services": "Unmanaged browsers are a frequent finding in FCA and PCI-DSS audits — frame browser governance as a compliance gap, not just an IT preference.",
            "technology": "Even tech-savvy teams often have blind spots here — browser-based credential harvesting and OAuth token theft target developers specifically."
          },
          "answerChips": [
            {
              "id": "no-central-policy",
              "label": "No central browser policy",
              "pitchBullet": "Chrome Admin Console pushes security policies to every managed browser instantly — no user prompt or action required",
              "sayThis": "So today, any employee can change their browser settings or disable protections without IT knowing. That's the exact gap CEP closes.",
              "deepDive": {
                "howItWorks": "Chrome Admin Console is a cloud-hosted management console — no on-prem infrastructure required. Connect it to Google Workspace or Entra ID/Azure AD, and every policy you configure applies the instant a user signs into managed Chrome with their work account: extension controls, DLP rules, safe browsing enforcement, site restrictions. The managed profile follows the user to any device they sign into. Set it once; it applies everywhere across the fleet.",
                "additionalProtections": [
                  "Policy sync in under 15 minutes — changes apply fleet-wide without any endpoint visits",
                  "Separate work and personal Chrome profiles on the same device — policies only apply inside the work context, personal browsing stays private",
                  "Force-install approved extensions and block high-risk ones from one central console"
                ],
                "proofPoint": "Most organisations complete initial CEP policy configuration in 2–4 hours of IT time. Zero endpoint visits, zero user disruption."
              }
            },
            {
              "id": "no-extension-control",
              "label": "No extension visibility/control",
              "pitchBullet": "CEP shows every extension installed across the entire fleet in real time, and lets IT block risky ones or force-install approved ones centrally",
              "sayThis": "Browser extensions can read every page a user opens — including login screens and sensitive documents. Without visibility, you have no idea what's running across your org.",
              "deepDive": {
                "howItWorks": "The Chrome Admin Console provides a live inventory of every extension installed across your managed fleet — grouped by extension, user, or device. Each extension shows its name, version, publisher, permissions requested (e.g., 'access all site data'), and a risk classification. You can block specific extensions by ID, block entire categories (e.g., all screen recorders), force-install approved extensions, or set allowlist mode so users can only install pre-approved extensions. Changes apply within 15 minutes with no user action required.",
                "additionalProtections": [
                  "New extension install alerts — notified immediately when any user installs an extension not on your approved list",
                  "Extension update monitoring — flag when an approved extension receives a major update that changes its permission scope",
                  "Shadow IT discovery — extensions often reveal unsanctioned SaaS tools accessing sensitive pages (Grammarly reading HR docs, personal AI assistants reading CRM data)"
                ],
                "proofPoint": "In a typical 500-seat first extension audit, organisations find an average of 12–15 high-risk extensions — screen recorders, in-browser credential managers, and productivity tools with excessive data access permissions."
              }
            },
            {
              "id": "manual-updates",
              "label": "Users self-update (or don't)",
              "pitchBullet": "CEP enforces silent Chrome auto-updates across all managed browsers — always current, no user prompt, no exceptions",
              "sayThis": "Outdated browsers are one of the top five exploit entry points. If updates depend on users, you'll always have a tail of vulnerable versions.",
              "deepDive": {
                "howItWorks": "CEP's update policy enforces Chrome auto-updates across all managed browsers — you set a minimum acceptable version and users cannot postpone or disable updates. Chrome releases a new stable version every 4 weeks; with CEP enforcement, your entire fleet can be on the latest version within hours of release. You can also configure a staged rollout — push to a test group first, validate, then fleet-wide. All enforced remotely from Admin Console.",
                "additionalProtections": [
                  "Update compliance reporting — real-time dashboard showing which devices are on which Chrome version",
                  "Block older insecure versions from accessing corporate Workspace apps via access policy",
                  "Zero user action required — silent background update, no pop-ups, no deferred restarts"
                ],
                "proofPoint": "The average enterprise browser fleet lags 30–60 days behind the latest Chrome release. In that window, known CVEs with public exploits are actively used in attacks. CEP closes that gap."
              }
            },
            {
              "id": "mixed-browsers",
              "label": "Mixed / uncontrolled browsers",
              "pitchBullet": "CEP deploys a managed Chrome profile that coexists with personal browsers — no user change required, full IT policy control in the work profile",
              "sayThis": "You can't enforce consistent security policies across Chrome, Edge, and Firefox simultaneously. CEP makes Chrome the managed work browser without asking anyone to switch their personal setup.",
              "deepDive": {
                "howItWorks": "CEP deploys as a managed Chrome profile alongside whatever browsers the user already has. The user's personal Chrome profile stays completely unchanged — their bookmarks, extensions, and history are untouched. The work Chrome profile (identifiable by a managed badge) enforces all IT policies: DLP, extension controls, safe browsing, site restrictions. For Microsoft shops, managed Chrome coexists with Edge — users can switch based on task. CEP doesn't remove anything; it adds a controlled work context.",
                "additionalProtections": [
                  "SSO integration — Entra ID or Workspace credentials auto-sign the work profile, no separate login",
                  "Works on Windows, Mac, Linux, and ChromeOS — the same managed profile experience on every device the user signs into",
                  "Profile switching is instant — users move between work and personal Chrome with one click"
                ],
                "proofPoint": "The 'users won't change' objection dissolves here — they don't change anything. They get a second profile badge in their existing Chrome browser. Most users forget it's there within a week."
              }
            }
          ]
        },
        {
          "id": "d-q-legacy-apps",
          "question": "Do any of your teams rely on Windows-based or legacy applications that need a specific environment to run?",
          "purpose": "Surface the Cameyo opportunity. Any Windows or legacy app dependency — Citrix, RDS, local installs — is a direct use case for app delivery in the browser.",
          "followUps": [
            "How are those apps delivered today — Citrix, RDS, local install?",
            "How many users need access, and on what types of devices?",
            "What's the current cost per seat for that infrastructure — licenses, servers, IT support?"
          ],
          "keywords": ["legacy", "windows", "citrix", "rdp", "rds", "vdi", "vmware", "horizon", "xenapp", "application", "erp", "sap", "software"],
          "industryTips": {
            "manufacturing": "Manufacturing teams almost always have legacy ERP, MES, or SCADA systems that need Windows. Ask specifically about shop floor access.",
            "retail": "Back-office and POS management tools are often Windows-only — Cameyo delivers these to any device, including Chromebooks in stores.",
            "professional-services": "Ask about legacy time-billing, case management, or document management systems — these are often the last reason a firm maintains Windows infrastructure."
          },
          "answerChips": [
            {
              "id": "has-citrix-rds",
              "label": "Has Citrix / RDS / VDI",
              "pitchBullet": "Cameyo replaces Citrix and RDS infrastructure entirely — Windows apps stream in a Chrome tab at 40–60% lower TCO, with zero servers to maintain",